{"authorized_behavior_sources_sha256":"sha256:20f471419bdde00fcb970a0008fffe75dd571f986946e8cb4af4599a2b81aebf","batches":[{"batch_id":"BATCH-000001","items":[{"accounted_range":{"end":39,"start":0},"domain_key":"_supplied","item_id":"ITEM-000001","read_range":{"end":39,"start":0},"source_id":"REQ-synthetic"}]},{"batch_id":"BATCH-000002","items":[{"accounted_range":{"end":41,"start":0},"domain_key":"_root","item_id":"ITEM-000002","read_range":{"end":41,"start":0},"source_id":"SOURCE-fd794e4081e27177d36a68cf917f712c6981d175c3bf3d45f890367a92645c75"}]}],"schema_version":"1.0.0","selected_module":"backend"}
